{
  "$schema": "https://json-schema.org/draft/2020-12/schema",
  "$id": "urn:oasis:names:specification:ubl:schema:json:Statement-2",
  "description": "A document used to report the status of orders, billing, and payment. This document is a statement of account, not a summary invoice.",
  "type": "object",
  "properties": {
    "UBLEntity": {
      "const": "urn:oasis:names:specification:ubl:schema:json:Statement-2",
      "description": "Identifies the JSON schema governing this instance."
    },
    "UBLExtensions": {
      "$ref": "urn:oasis:names:specification:ubl:schema:json:CommonExtensionComponents-2#/$defs/UBLExtensionsType"
    },
    "Signature": {
      "oneOf": [
        {
          "$ref": "urn:oasis:names:specification:ubl:schema:json:CommonAggregateComponents-2#/$defs/SignatureType"
        },
        {
          "type": "array",
          "items": {
            "$ref": "urn:oasis:names:specification:ubl:schema:json:CommonAggregateComponents-2#/$defs/SignatureType"
          }
        }
      ]
    },
    "UBLVersionID": {
      "$ref": "urn:oasis:names:specification:ubl:schema:json:CommonBasicComponents-2#/$defs/UBLVersionID"
    },
    "CustomizationID": {
      "$ref": "urn:oasis:names:specification:ubl:schema:json:CommonBasicComponents-2#/$defs/CustomizationID"
    },
    "ProfileID": {
      "$ref": "urn:oasis:names:specification:ubl:schema:json:CommonBasicComponents-2#/$defs/ProfileID"
    },
    "ProfileExecutionID": {
      "$ref": "urn:oasis:names:specification:ubl:schema:json:CommonBasicComponents-2#/$defs/ProfileExecutionID"
    },
    "ID": {
      "$ref": "urn:oasis:names:specification:ubl:schema:json:CommonBasicComponents-2#/$defs/ID"
    },
    "UUID": {
      "$ref": "urn:oasis:names:specification:ubl:schema:json:CommonBasicComponents-2#/$defs/UUID"
    },
    "IssueDate": {
      "$ref": "urn:oasis:names:specification:ubl:schema:json:CommonBasicComponents-2#/$defs/IssueDate"
    },
    "IssueTime": {
      "$ref": "urn:oasis:names:specification:ubl:schema:json:CommonBasicComponents-2#/$defs/IssueTime"
    },
    "Note": {
      "oneOf": [
        {
          "$ref": "urn:oasis:names:specification:ubl:schema:json:CommonBasicComponents-2#/$defs/Note"
        },
        {
          "type": "array",
          "items": {
            "$ref": "urn:oasis:names:specification:ubl:schema:json:CommonBasicComponents-2#/$defs/Note"
          }
        }
      ]
    },
    "DocumentCurrencyCode": {
      "$ref": "urn:oasis:names:specification:ubl:schema:json:CommonBasicComponents-2#/$defs/DocumentCurrencyCode"
    },
    "TotalDebitAmount": {
      "$ref": "urn:oasis:names:specification:ubl:schema:json:CommonBasicComponents-2#/$defs/TotalDebitAmount"
    },
    "TotalCreditAmount": {
      "$ref": "urn:oasis:names:specification:ubl:schema:json:CommonBasicComponents-2#/$defs/TotalCreditAmount"
    },
    "TotalBalanceAmount": {
      "$ref": "urn:oasis:names:specification:ubl:schema:json:CommonBasicComponents-2#/$defs/TotalBalanceAmount"
    },
    "LineCountNumeric": {
      "$ref": "urn:oasis:names:specification:ubl:schema:json:CommonBasicComponents-2#/$defs/LineCountNumeric"
    },
    "StatementTypeCode": {
      "$ref": "urn:oasis:names:specification:ubl:schema:json:CommonBasicComponents-2#/$defs/StatementTypeCode"
    },
    "StatementPeriod": {
      "$ref": "urn:oasis:names:specification:ubl:schema:json:CommonAggregateComponents-2#/$defs/PeriodType"
    },
    "AdditionalDocumentReference": {
      "oneOf": [
        {
          "$ref": "urn:oasis:names:specification:ubl:schema:json:CommonAggregateComponents-2#/$defs/DocumentReferenceType"
        },
        {
          "type": "array",
          "items": {
            "$ref": "urn:oasis:names:specification:ubl:schema:json:CommonAggregateComponents-2#/$defs/DocumentReferenceType"
          }
        }
      ]
    },
    "AccountingSupplierParty": {
      "$ref": "urn:oasis:names:specification:ubl:schema:json:CommonAggregateComponents-2#/$defs/SupplierPartyType"
    },
    "AccountingCustomerParty": {
      "$ref": "urn:oasis:names:specification:ubl:schema:json:CommonAggregateComponents-2#/$defs/CustomerPartyType"
    },
    "BuyerCustomerParty": {
      "$ref": "urn:oasis:names:specification:ubl:schema:json:CommonAggregateComponents-2#/$defs/CustomerPartyType"
    },
    "SellerSupplierParty": {
      "$ref": "urn:oasis:names:specification:ubl:schema:json:CommonAggregateComponents-2#/$defs/SupplierPartyType"
    },
    "OriginatorCustomerParty": {
      "$ref": "urn:oasis:names:specification:ubl:schema:json:CommonAggregateComponents-2#/$defs/CustomerPartyType"
    },
    "BeneficiaryParty": {
      "oneOf": [
        {
          "$ref": "urn:oasis:names:specification:ubl:schema:json:CommonAggregateComponents-2#/$defs/PartyType"
        },
        {
          "type": "array",
          "items": {
            "$ref": "urn:oasis:names:specification:ubl:schema:json:CommonAggregateComponents-2#/$defs/PartyType"
          }
        }
      ]
    },
    "PayeeParty": {
      "$ref": "urn:oasis:names:specification:ubl:schema:json:CommonAggregateComponents-2#/$defs/PartyType"
    },
    "PaymentMeans": {
      "oneOf": [
        {
          "$ref": "urn:oasis:names:specification:ubl:schema:json:CommonAggregateComponents-2#/$defs/PaymentMeansType"
        },
        {
          "type": "array",
          "items": {
            "$ref": "urn:oasis:names:specification:ubl:schema:json:CommonAggregateComponents-2#/$defs/PaymentMeansType"
          }
        }
      ]
    },
    "PaymentTerms": {
      "oneOf": [
        {
          "$ref": "urn:oasis:names:specification:ubl:schema:json:CommonAggregateComponents-2#/$defs/PaymentTermsType"
        },
        {
          "type": "array",
          "items": {
            "$ref": "urn:oasis:names:specification:ubl:schema:json:CommonAggregateComponents-2#/$defs/PaymentTermsType"
          }
        }
      ]
    },
    "AllowanceCharge": {
      "oneOf": [
        {
          "$ref": "urn:oasis:names:specification:ubl:schema:json:CommonAggregateComponents-2#/$defs/AllowanceChargeType"
        },
        {
          "type": "array",
          "items": {
            "$ref": "urn:oasis:names:specification:ubl:schema:json:CommonAggregateComponents-2#/$defs/AllowanceChargeType"
          }
        }
      ]
    },
    "TaxTotal": {
      "oneOf": [
        {
          "$ref": "urn:oasis:names:specification:ubl:schema:json:CommonAggregateComponents-2#/$defs/TaxTotalType"
        },
        {
          "type": "array",
          "items": {
            "$ref": "urn:oasis:names:specification:ubl:schema:json:CommonAggregateComponents-2#/$defs/TaxTotalType"
          }
        }
      ]
    },
    "StatementLine": {
      "oneOf": [
        {
          "$ref": "urn:oasis:names:specification:ubl:schema:json:CommonAggregateComponents-2#/$defs/StatementLineType"
        },
        {
          "type": "array",
          "items": {
            "$ref": "urn:oasis:names:specification:ubl:schema:json:CommonAggregateComponents-2#/$defs/StatementLineType"
          },
          "minItems": 1
        }
      ]
    }
  },
  "required": [
    "UBLEntity",
    "ID",
    "IssueDate",
    "DocumentCurrencyCode",
    "AccountingSupplierParty",
    "AccountingCustomerParty",
    "StatementLine"
  ],
  "additionalProperties": false,
  "minProperties": 1,
  "title": "Statement. Details"
}
